{
  "$schema": "https://raw.githubusercontent.com/Naptie/openmetro/main/schemas/v1/timetables.schema.json",
  "schema_version": "1.0",
  "network_id": "cn-hohhot",
  "generated_at": "2026-10-22T14:54:59.647Z",
  "source": [],
  "records": [
    {
      "id": "cn-hohhot-tt-cn-hohhot-aershan-road-2-up",
      "station_id": "cn-hohhot-aershan-road",
      "stop_id": "cn-hohhot-aershan-road-2",
      "line_id": "cn-hohhot-line-2",
      "source_id": "baidu-direction-v2-transit",
      "destination_stop_id": "cn-hohhot-tali-east-road-2",
      "origin_stop_id": "cn-hohhot-aershan-road-2",
      "pattern_id": "cn-hohhot-pattern-2-primary",
      "direction_type": "linear",
      "direction_label": "往塔利东路方向",
      "first_train": [
        "06:00"
      ],
      "last_train": [
        "22:04"
      ],
      "service": "all_days",
      "extras": {
        "line_short_name": "2",
        "calendar": "all_days"
      }
    },
    {
      "id": "cn-hohhot-tt-cn-hohhot-affiliated-hospital-1-down",
      "station_id": "cn-hohhot-affiliated-hospital",
      "stop_id": "cn-hohhot-affiliated-hospital-1",
      "line_id": "cn-hohhot-line-1",
      "source_id": "baidu-direction-v2-transit",
      "destination_stop_id": "cn-hohhot-bayan-airport-1",
      "origin_stop_id": "cn-hohhot-yili-health-valley-1",
      "pattern_id": "cn-hohhot-pattern-1-primary",
      "direction_type": "linear",
      "direction_label": "往坝堰(机场)(国内航站楼)方向",
      "first_train": [
        "06:15"
      ],
      "last_train": [
        "22:24"
      ],
      "service": "all_days",
      "extras": {
        "line_short_name": "1",
        "calendar": "all_days"
      }
    },
    {
      "id": "cn-hohhot-tt-cn-hohhot-affiliated-hospital-1-up",
      "station_id": "cn-hohhot-affiliated-hospital",
      "stop_id": "cn-hohhot-affiliated-hospital-1",
      "line_id": "cn-hohhot-line-1",
      "source_id": "baidu-direction-v2-transit",
      "destination_stop_id": "cn-hohhot-yili-health-valley-1",
      "origin_stop_id": "cn-hohhot-bayan-airport-1",
      "pattern_id": "cn-hohhot-pattern-1-primary",
      "direction_type": "linear",
      "direction_label": "往伊利健康谷方向",
      "first_train": [
        "06:27"
      ],
      "last_train": [
        "22:30"
      ],
      "service": "all_days",
      "extras": {
        "line_short_name": "1",
        "calendar": "all_days"
      }
    },
    {
      "id": "cn-hohhot-tt-cn-hohhot-arts-college-1-down",
      "station_id": "cn-hohhot-arts-college",
      "stop_id": "cn-hohhot-arts-college-1",
      "line_id": "cn-hohhot-line-1",
      "source_id": "baidu-direction-v2-transit",
      "destination_stop_id": "cn-hohhot-bayan-airport-1",
      "origin_stop_id": "cn-hohhot-yili-health-valley-1",
      "pattern_id": "cn-hohhot-pattern-1-primary",
      "direction_type": "linear",
      "direction_label": "往坝堰(机场)(国内航站楼)方向",
      "first_train": [
        "06:22"
      ],
      "last_train": [
        "22:33"
      ],
      "service": "all_days",
      "extras": {
        "line_short_name": "1",
        "calendar": "all_days"
      }
    },
    {
      "id": "cn-hohhot-tt-cn-hohhot-arts-college-1-up",
      "station_id": "cn-hohhot-arts-college",
      "stop_id": "cn-hohhot-arts-college-1",
      "line_id": "cn-hohhot-line-1",
      "source_id": "baidu-direction-v2-transit",
      "destination_stop_id": "cn-hohhot-yili-health-valley-1",
      "origin_stop_id": "cn-hohhot-bayan-airport-1",
      "pattern_id": "cn-hohhot-pattern-1-primary",
      "direction_type": "linear",
      "direction_label": "往伊利健康谷方向",
      "first_train": [
        "06:19"
      ],
      "last_train": [
        "22:21"
      ],
      "service": "all_days",
      "extras": {
        "line_short_name": "1",
        "calendar": "all_days"
      }
    },
    {
      "id": "cn-hohhot-tt-cn-hohhot-baihe-road-2-down",
      "station_id": "cn-hohhot-baihe-road",
      "stop_id": "cn-hohhot-baihe-road-2",
      "line_id": "cn-hohhot-line-2",
      "source_id": "baidu-direction-v2-transit",
      "destination_stop_id": "cn-hohhot-aershan-road-2",
      "origin_stop_id": "cn-hohhot-tali-east-road-2",
      "pattern_id": "cn-hohhot-pattern-2-primary",
      "direction_type": "linear",
      "direction_label": "往阿尔山路方向",
      "first_train": [
        "06:03"
      ],
      "last_train": [
        "22:03"
      ],
      "service": "all_days",
      "extras": {
        "line_short_name": "2",
        "calendar": "all_days"
      }
    },
    {
      "id": "cn-hohhot-tt-cn-hohhot-baihe-road-2-up",
      "station_id": "cn-hohhot-baihe-road",
      "stop_id": "cn-hohhot-baihe-road-2",
      "line_id": "cn-hohhot-line-2",
      "source_id": "baidu-direction-v2-transit",
      "destination_stop_id": "cn-hohhot-tali-east-road-2",
      "origin_stop_id": "cn-hohhot-aershan-road-2",
      "pattern_id": "cn-hohhot-pattern-2-primary",
      "direction_type": "linear",
      "direction_label": "往塔利东路方向",
      "first_train": [
        "06:44"
      ],
      "last_train": [
        "22:50"
      ],
      "service": "all_days",
      "extras": {
        "line_short_name": "2",
        "calendar": "all_days"
      }
    },
    {
      "id": "cn-hohhot-tt-cn-hohhot-baita-west-1-down",
      "station_id": "cn-hohhot-baita-west",
      "stop_id": "cn-hohhot-baita-west-1",
      "line_id": "cn-hohhot-line-1",
      "source_id": "baidu-direction-v2-transit",
      "destination_stop_id": "cn-hohhot-bayan-airport-1",
      "origin_stop_id": "cn-hohhot-yili-health-valley-1",
      "pattern_id": "cn-hohhot-pattern-1-primary",
      "direction_type": "linear",
      "direction_label": "往坝堰(机场)(国内航站楼)方向",
      "first_train": [
        "06:40"
      ],
      "last_train": [
        "22:51"
      ],
      "service": "all_days",
      "extras": {
        "line_short_name": "1",
        "calendar": "all_days"
      }
    },
    {
      "id": "cn-hohhot-tt-cn-hohhot-baita-west-1-up",
      "station_id": "cn-hohhot-baita-west",
      "stop_id": "cn-hohhot-baita-west-1",
      "line_id": "cn-hohhot-line-1",
      "source_id": "baidu-direction-v2-transit",
      "destination_stop_id": "cn-hohhot-yili-health-valley-1",
      "origin_stop_id": "cn-hohhot-bayan-airport-1",
      "pattern_id": "cn-hohhot-pattern-1-primary",
      "direction_type": "linear",
      "direction_label": "往伊利健康谷方向",
      "first_train": [
        "06:02"
      ],
      "last_train": [
        "22:03"
      ],
      "service": "all_days",
      "extras": {
        "line_short_name": "1",
        "calendar": "all_days"
      }
    },
    {
      "id": "cn-hohhot-tt-cn-hohhot-bayan-airport-1-up",
      "station_id": "cn-hohhot-bayan-airport",
      "stop_id": "cn-hohhot-bayan-airport-1",
      "line_id": "cn-hohhot-line-1",
      "source_id": "baidu-direction-v2-transit",
      "destination_stop_id": "cn-hohhot-yili-health-valley-1",
      "origin_stop_id": "cn-hohhot-bayan-airport-1",
      "pattern_id": "cn-hohhot-pattern-1-primary",
      "direction_type": "linear",
      "direction_label": "往伊利健康谷方向",
      "first_train": [
        "06:00"
      ],
      "last_train": [
        "22:01"
      ],
      "service": "all_days",
      "extras": {
        "line_short_name": "1",
        "calendar": "all_days"
      }
    },
    {
      "id": "cn-hohhot-tt-cn-hohhot-beishan-park-2-down",
      "station_id": "cn-hohhot-beishan-park",
      "stop_id": "cn-hohhot-beishan-park-2",
      "line_id": "cn-hohhot-line-2",
      "source_id": "baidu-direction-v2-transit",
      "destination_stop_id": "cn-hohhot-aershan-road-2",
      "origin_stop_id": "cn-hohhot-tali-east-road-2",
      "pattern_id": "cn-hohhot-pattern-2-primary",
      "direction_type": "linear",
      "direction_label": "往阿尔山路方向",
      "first_train": [
        "06:05"
      ],
      "last_train": [
        "22:05"
      ],
      "service": "all_days",
      "extras": {
        "line_short_name": "2",
        "calendar": "all_days"
      }
    },
    {
      "id": "cn-hohhot-tt-cn-hohhot-beishan-park-2-up",
      "station_id": "cn-hohhot-beishan-park",
      "stop_id": "cn-hohhot-beishan-park-2",
      "line_id": "cn-hohhot-line-2",
      "source_id": "baidu-direction-v2-transit",
      "destination_stop_id": "cn-hohhot-tali-east-road-2",
      "origin_stop_id": "cn-hohhot-aershan-road-2",
      "pattern_id": "cn-hohhot-pattern-2-primary",
      "direction_type": "linear",
      "direction_label": "往塔利东路方向",
      "first_train": [
        "06:42"
      ],
      "last_train": [
        "22:48"
      ],
      "service": "all_days",
      "extras": {
        "line_short_name": "2",
        "calendar": "all_days"
      }
    },
    {
      "id": "cn-hohhot-tt-cn-hohhot-city-government-1-down",
      "station_id": "cn-hohhot-city-government",
      "stop_id": "cn-hohhot-city-government-1",
      "line_id": "cn-hohhot-line-1",
      "source_id": "baidu-direction-v2-transit",
      "destination_stop_id": "cn-hohhot-bayan-airport-1",
      "origin_stop_id": "cn-hohhot-yili-health-valley-1",
      "pattern_id": "cn-hohhot-pattern-1-primary",
      "direction_type": "linear",
      "direction_label": "往坝堰(机场)(国内航站楼)方向",
      "first_train": [
        "06:30"
      ],
      "last_train": [
        "22:41"
      ],
      "service": "all_days",
      "extras": {
        "line_short_name": "1",
        "calendar": "all_days"
      }
    },
    {
      "id": "cn-hohhot-tt-cn-hohhot-city-government-1-up",
      "station_id": "cn-hohhot-city-government",
      "stop_id": "cn-hohhot-city-government-1",
      "line_id": "cn-hohhot-line-1",
      "source_id": "baidu-direction-v2-transit",
      "destination_stop_id": "cn-hohhot-yili-health-valley-1",
      "origin_stop_id": "cn-hohhot-bayan-airport-1",
      "pattern_id": "cn-hohhot-pattern-1-primary",
      "direction_type": "linear",
      "direction_label": "往伊利健康谷方向",
      "first_train": [
        "06:11"
      ],
      "last_train": [
        "22:12"
      ],
      "service": "all_days",
      "extras": {